{
  "source": "Aviary paired answer citation page reach comparison",
  "schemaVersion": 1,
  "pageScope": "all-cited-pages",
  "summary": {
    "row_type": "summary",
    "page_scope": "all-cited-pages",
    "provider": null,
    "page_url": null,
    "baseline_provider_prompt_groups": null,
    "current_provider_prompt_groups": null,
    "shared_exact_prompt_groups": null,
    "comparable_prompt_groups": null,
    "unknown_page_prompt_groups": null,
    "baseline_present_prompts": null,
    "current_present_prompts": null,
    "gained_prompts": null,
    "lost_prompts": null,
    "present_both_periods": null,
    "absent_both_periods": null,
    "baseline_reach_percent": null,
    "current_reach_percent": null,
    "reach_change_percentage_points": null,
    "paired_prompt_bootstrap_ci95_lower_pp": null,
    "paired_prompt_bootstrap_ci95_upper_pp": null,
    "leave_one_prompt_out_minimum_change_pp": null,
    "leave_one_prompt_out_maximum_change_pp": null,
    "exact_two_sided_mcnemar_p_value": null,
    "holm_adjusted_mcnemar_p_value": null,
    "holm_family_size": 3,
    "top_three_comparable_prompt_groups": null,
    "top_three_unknown_prompt_groups": null,
    "baseline_top_three_prompts": null,
    "current_top_three_prompts": null,
    "gained_top_three_prompts": null,
    "lost_top_three_prompts": null,
    "top_three_reach_change_percentage_points": null,
    "top_three_bootstrap_ci95_lower_pp": null,
    "top_three_bootstrap_ci95_upper_pp": null,
    "exact_top_three_mcnemar_p_value": null,
    "holm_adjusted_top_three_mcnemar_p_value": null,
    "top_three_holm_family_size": 3,
    "first_position_comparable_prompt_groups": null,
    "first_position_unknown_prompt_groups": null,
    "baseline_first_position_prompts": null,
    "current_first_position_prompts": null,
    "gained_first_position_prompts": null,
    "lost_first_position_prompts": null,
    "first_position_reach_change_percentage_points": null,
    "first_position_bootstrap_ci95_lower_pp": null,
    "first_position_bootstrap_ci95_upper_pp": null,
    "exact_first_position_mcnemar_p_value": null,
    "holm_adjusted_first_position_mcnemar_p_value": null,
    "first_position_holm_family_size": null,
    "paired_prompt_bootstrap_resamples": 1000,
    "comparison_complete": false,
    "holm_family_complete": true,
    "top_three_holm_family_complete": true,
    "first_position_holm_family_complete": false,
    "projected_rows": 9,
    "projected_prompt_page_evaluations": 3,
    "output_rows_truncated": false,
    "prompt_page_evaluations_truncated": false,
    "interpretation_note": "All exact cited URLs from either sample are included. Each normalized exact prompt counts once within a provider after pooling repeated captures. URLs are normalized by dropping query strings and fragments. A cited page is present when any capture in the provider/prompt group listed it; absence is known only when every capture for that group reports a complete citation list. Reach, top-three reach, and first-position reach each use endpoint-specific comparable prompt denominators and separate Holm families. Rows compare only exact prompts present in both samples. Model, surface, locale, topic, intent, and repeated-capture context are pooled and should be held stable for controlled comparisons. Holm correction for an endpoint is available only when every retained page/provider state for that endpoint is known. These manually sampled page citations do not establish engine visibility or causation."
  },
  "rows": [
    {
      "row_type": "page-provider",
      "page_scope": "all-cited-pages",
      "provider": "ChatGPT Search",
      "page_url": "https://design.example.org/color-contrast",
      "baseline_provider_prompt_groups": 1,
      "current_provider_prompt_groups": 1,
      "shared_exact_prompt_groups": 1,
      "comparable_prompt_groups": 1,
      "unknown_page_prompt_groups": 0,
      "baseline_present_prompts": 0,
      "current_present_prompts": 1,
      "gained_prompts": 1,
      "lost_prompts": 0,
      "present_both_periods": "0",
      "absent_both_periods": "0",
      "baseline_reach_percent": 0,
      "current_reach_percent": 100,
      "reach_change_percentage_points": "100",
      "paired_prompt_bootstrap_ci95_lower_pp": null,
      "paired_prompt_bootstrap_ci95_upper_pp": null,
      "leave_one_prompt_out_minimum_change_pp": null,
      "leave_one_prompt_out_maximum_change_pp": null,
      "exact_two_sided_mcnemar_p_value": 1,
      "holm_adjusted_mcnemar_p_value": 1,
      "holm_family_size": 3,
      "top_three_comparable_prompt_groups": 1,
      "top_three_unknown_prompt_groups": 0,
      "baseline_top_three_prompts": 0,
      "current_top_three_prompts": 1,
      "gained_top_three_prompts": 1,
      "lost_top_three_prompts": 0,
      "top_three_reach_change_percentage_points": "100",
      "top_three_bootstrap_ci95_lower_pp": null,
      "top_three_bootstrap_ci95_upper_pp": null,
      "exact_top_three_mcnemar_p_value": 1,
      "holm_adjusted_top_three_mcnemar_p_value": 1,
      "top_three_holm_family_size": 3,
      "first_position_comparable_prompt_groups": 1,
      "first_position_unknown_prompt_groups": 0,
      "baseline_first_position_prompts": 0,
      "current_first_position_prompts": 1,
      "gained_first_position_prompts": 1,
      "lost_first_position_prompts": 0,
      "first_position_reach_change_percentage_points": "100",
      "first_position_bootstrap_ci95_lower_pp": null,
      "first_position_bootstrap_ci95_upper_pp": null,
      "exact_first_position_mcnemar_p_value": 1,
      "holm_adjusted_first_position_mcnemar_p_value": null,
      "first_position_holm_family_size": null,
      "paired_prompt_bootstrap_resamples": 1000,
      "comparison_complete": true,
      "holm_family_complete": true,
      "top_three_holm_family_complete": true,
      "first_position_holm_family_complete": false,
      "projected_rows": 9,
      "projected_prompt_page_evaluations": 3,
      "output_rows_truncated": false,
      "prompt_page_evaluations_truncated": false,
      "interpretation_note": "All exact cited URLs from either sample are included. Each normalized exact prompt counts once within a provider after pooling repeated captures. URLs are normalized by dropping query strings and fragments. A cited page is present when any capture in the provider/prompt group listed it; absence is known only when every capture for that group reports a complete citation list. Reach, top-three reach, and first-position reach each use endpoint-specific comparable prompt denominators and separate Holm families. Rows compare only exact prompts present in both samples. Model, surface, locale, topic, intent, and repeated-capture context are pooled and should be held stable for controlled comparisons. Holm correction for an endpoint is available only when every retained page/provider state for that endpoint is known. These manually sampled page citations do not establish engine visibility or causation."
    },
    {
      "row_type": "page-provider",
      "page_scope": "all-cited-pages",
      "provider": "ChatGPT Search",
      "page_url": "https://example.com/guides/color-accessibility",
      "baseline_provider_prompt_groups": 1,
      "current_provider_prompt_groups": 1,
      "shared_exact_prompt_groups": 1,
      "comparable_prompt_groups": 1,
      "unknown_page_prompt_groups": 0,
      "baseline_present_prompts": 0,
      "current_present_prompts": 1,
      "gained_prompts": 1,
      "lost_prompts": 0,
      "present_both_periods": "0",
      "absent_both_periods": "0",
      "baseline_reach_percent": 0,
      "current_reach_percent": 100,
      "reach_change_percentage_points": "100",
      "paired_prompt_bootstrap_ci95_lower_pp": null,
      "paired_prompt_bootstrap_ci95_upper_pp": null,
      "leave_one_prompt_out_minimum_change_pp": null,
      "leave_one_prompt_out_maximum_change_pp": null,
      "exact_two_sided_mcnemar_p_value": 1,
      "holm_adjusted_mcnemar_p_value": 1,
      "holm_family_size": 3,
      "top_three_comparable_prompt_groups": 1,
      "top_three_unknown_prompt_groups": 0,
      "baseline_top_three_prompts": 0,
      "current_top_three_prompts": 1,
      "gained_top_three_prompts": 1,
      "lost_top_three_prompts": 0,
      "top_three_reach_change_percentage_points": "100",
      "top_three_bootstrap_ci95_lower_pp": null,
      "top_three_bootstrap_ci95_upper_pp": null,
      "exact_top_three_mcnemar_p_value": 1,
      "holm_adjusted_top_three_mcnemar_p_value": 1,
      "top_three_holm_family_size": 3,
      "first_position_comparable_prompt_groups": 1,
      "first_position_unknown_prompt_groups": 0,
      "baseline_first_position_prompts": 0,
      "current_first_position_prompts": 1,
      "gained_first_position_prompts": 1,
      "lost_first_position_prompts": 0,
      "first_position_reach_change_percentage_points": "100",
      "first_position_bootstrap_ci95_lower_pp": null,
      "first_position_bootstrap_ci95_upper_pp": null,
      "exact_first_position_mcnemar_p_value": 1,
      "holm_adjusted_first_position_mcnemar_p_value": null,
      "first_position_holm_family_size": null,
      "paired_prompt_bootstrap_resamples": 1000,
      "comparison_complete": true,
      "holm_family_complete": true,
      "top_three_holm_family_complete": true,
      "first_position_holm_family_complete": false,
      "projected_rows": 9,
      "projected_prompt_page_evaluations": 3,
      "output_rows_truncated": false,
      "prompt_page_evaluations_truncated": false,